{
  "hostname": "auto",
  "interval_seconds": 60,
  "state_file": "/var/lib/agentpulse/state.json",
  "log_file": "/var/log/agentpulse/agentpulse.log",

  "notify": {
    "type": "stdout",
    "webhook_url": ""
  },

  "checks": {
    "disk": {
      "mode": "alert",
      "threshold_percent": 90,
      "paths": ["/"],
      "cleanup_globs": ["/tmp/*", "/var/tmp/*"],
      "cleanup_older_than_days": 3
    },

    "service": {
      "mode": "alert",
      "services": ["nginx"]
    },

    "process": {
      "mode": "alert",
      "mem_percent_threshold": 85
    }
  },

  "_comments": {
    "safety": "Every check ships in 'alert' mode. The agent only WATCHES until you change a mode to 'ask' (queue for your approval) or 'auto' (act on its own). Nothing is auto-fixed by default.",
    "modes": "off | alert | ask | auto",
    "disk_auto": "Set checks.disk.mode to 'auto' only after you trust cleanup_globs. The agent deletes regular files older than cleanup_older_than_days inside those globs only, never directories, never symlinks, never system paths.",
    "service_auto": "Set checks.service.mode to 'auto' to let the agent restart a failed service in the allowlist. Use 'ask' if you'd rather approve each restart.",
    "process_note": "The process check NEVER kills automatically in v1, even if set to 'auto' (it is clamped to 'ask'). It flags the single largest memory user above the threshold."
  }
}
